{
  "schemaVersion": "1",
  "baseRevision": 3,
  "targetDraftId": "0d5e6b1a-1111-4a2b-9c3d-111111111111",
  "origin": "compare",
  "operations": [
    {
      "opId": "op-replace-kernel",
      "op": "replace",
      "path": "/selections/0/value",
      "before": {
        "kind": "single",
        "optionId": "archmaker.kernel.linux"
      },
      "after": {
        "kind": "single",
        "optionId": "archmaker.kernel.zen"
      },
      "note": "change.kernel"
    },
    {
      "opId": "op-add-secure-boot",
      "op": "add",
      "path": "/selections/1",
      "after": {
        "kind": "boolean",
        "value": true
      }
    }
  ],
  "summary": {
    "added": 1,
    "removed": 0,
    "changed": 1,
    "total": 2
  }
}
